Review,Liked
I booked the flight from Perth Australia to Bangkok in Thailand on 21th January at7pm. I arrived at the airport and the staff said there was no my name for passengers list. I got a confirmation E mail but the staff said I needed itinerary and they said your booking was on 22d at 7pm. I checked the travel detail through my account on Rumbo website and it was 21th. I had to fry on 21th so paid ＄210 extra to change the date and afterwards sent E mail 3 times to rumbo but Unfortunately I haven't got any replying. I called to them at the airport aswell but it was out of working hours.... I don't know what to do now but I shoud get money back otherwise It is clearly that I never want to use Rombo anymore,0
After I placed my order I believe on Dec 29th I broke my ankle and didn't check my emails for about 3 days. When I did check discovered my order had been canceled. (No one seems to know why). I replaced the order VIA phone and was promised shipment by UPS on Monday the 9th. Didn't receive the shipment until Friday the 13th by regular mail and not UPS,0
Delivery was longer than a month way too slow. I was not even notified about the delay I needed to make an inquiry and ask what is going on to be informed about the delay. That is not satisfactory of an online retailer.,0
The 2 wicker shelves I purchased each over $30 were not of good quality and certainly not worth $30 something! If I had paid $15 for each of those shelves then that would have been better than paying over $60 not including shipping either. The corner shelves the 2 top shelf hinges are not long enough to keep them down and the bottom shelf is missing the hinge all together! I fixed these myself because I wasn't going to throw away any more money by returning these items. The canvas tote on wheels was nice but it took too long to arrive. I placed my order 12/28/16 and the shelves arrived 1/10/17 and the tote on 1/11/17.,0
I have never ordered from a company and have it take almost 1 month to find out that it is now in transit. I still have yet to receive itso I am just assuming it will come. But this is a very slow company so if you don't mind waiting then it will be fine.,0
The got some info entered wrong I signed up days in advance and it cause my power to be cut off your fault not mine. I tried to get the power back on they said it would take 24 hours I got another company to do it in 4 hours sad when you let someone go who would have paid you money every month for the next who knows how many years,0
I felt like a number not a customer,0
Please feel free to contact me,0
Carter King 512.924.1011,0
"I sent you an email several days ago in regard to the condition of the items I ordered. The summary of the Email: ""6 boxes of band aids shipped in a plastic bag. The boxes were mashed so much they were scattered/mixed in the bag. Not a very smart way to ship these items. "". I have not received a reply back. Don't think I will order from you again if this is the way you treat your customers.",0
I purchased 8 boxes of contacts I should have done better research your company was not the cheapest. I spent over $400. I found them much cheaper at lens.com. I called your company to inquire if you price match she initially said yes but when I told her how much they were she instantly said no. She offered a $10 credit. I could have saved almost $200 by going with lens.com going forward I will be purchasing my contacts elsewhere. Your representative was rude I spent over $400 I can get better customer service somewhere else. Because of this situation you have lost a loyal customer.,0
They have a good prices but when they cancel my flight it took 4 phone calls with total 4 hours on the phone with no satisfactory at the endI decided for full refund-what caused me a lot of problemsand they told me,0
That It is going to take 6-8 weeks to get my money back??What a service.2 times they told me that they going to call me within 24 to 48 hours - nothing happend-no respond.,0
That is my experience-still waiting for my full refund,0
Have a nice day,0
I've been using this service many time but the 1st time i need to claim for something they are showing who they are: a low cost assurance with poor customer care. This is supposed to be for backpackers but it's not at all..,0
"My headset had audio problems so I decided to call support to get a repair done. First guy was one of the nicest and informational customer support out there. I got my headphones BUT when I sent them I guess he forgot to tell me not to put the cable in (which I put it in incase it was the cord that caused the sound not to work) so when the repaired headset I was missing the audio cable so now I had to do the process over again. This time I was connected to a man that was very irritated and just made it a lot harder to get my aux cable back very rude not actually trying to help me kind of ""just trying to do his job and go home.""",0
I called 2 times because I didn't know my dress size for a particular dress on the website and the lady I talked to told me I'm exactly a size 12 both times I called. I'm normally a size four or six and she insisted that I get a twelve and I did exactly what she said. I tried on the dress and it was extremely large. Not to mention it was expensive and it had been picked on the inside of the bust and there were stains on it. The lady was going to charge me a restocking fee to send it back however we worked it out and in the end she said she would refund the money and send me a return label so I wouldn't have to pay the extra fees. Overall the size chart is not correctly proportioned so if your going to order a dress from prom girl order your normal size.,0
I did my transactions more than 15 days ago  still did not received money in my India bank account. And still paying 10% APR  on the amount  since I needed that money urgently in India,0
My transaction numbers are as follows :,0
R21 030 835 351,0
R36 544 259 513,0
R40 118 514 373,0
R71 062 205 773,0
R75 069 839 217,0
OPERATORI CALL CENTER SCORTESI INFASTIDITI DECISAMENTE MALEDUCATI. HO SCELTO UN'ALTRA COMPAGNIA (NONOSTANTE PREZZO MENO VANTAGGIOSO) SOLO PER LA ORRENDA TELEFONATA CON OPERATRICE GENIALLOYD,0
This was a bad experience,0
Ive waited for my contacts for a while n when they arrived they were left outside for the whole day and they froze!!! I'm not happy about that. I wish they required signature because I work till late night and I'm not home the whole day. Ive had a bad experience and don't know if I will order from this website again,0
I paid $10 for a $20 discount code plus a $10 coupon.When I placed the order the coupon could not be applied. I contacted the customer service department on the next business day and they told me the coupon had expired and couldn't be applied.,0
My order was not delivered in the 2 days promised by you and paid for by me. My mother did not get her Christmas present on time. Poor customer service.,0
Awful experience Held my money for 2 weeks Hostage EMAILED ME 68 times for no reason to call your number and you call it and there isnt anyone there to PICK UP took me 2 weeks to get a hold of someone.. Pathetic,0
I went on a shopping spree spending a few hundred (and then some) on DHGate only to receive counterfeit items. When i brought this up to customer service for each individual order they told me that the products were not counterfeit and they couldn't see the comparison between what I received and what was described. The font's of the labels are different the packaging is off and the products themselves were faulty and not quite right. Everything is unsellable for my business. DHGate refuses to right the wrongs and keeps siding with the manufacturers on certain products. I've lost a lot of money and precious time dealing with this company. If something seems too good to be true guess what it usually is and thats what you'll get with DHGate.,0
Schlechter Kundenservice,0
Car wasnt exactly clean. Consultant was extremely polite however no very infomative.Ie do i have to fuel car up before return toll beeper.,0
Be warned and record conversations! I booked a compact automatic car for a month but was disappointed to receive a semi automatic cumbersome Fiat 500 ( dreadful car to drive) they said no other car was available at the time so I had to take it. After the drive to our destination I found the car to be difficult and in my eyes dangerous to drive as in a parked position it would roll forward downhill in REVERSE gear before enough acceleration was applied to move in the right direction i.e. Backwards and then it would lurch backwards in an uncontrollable manner. On ringing Centauro Malaga to complain I was told that Yes it was a difficult car to drive but in order to exchange it I had to return it to the office myself. Because of the difficulty and perceived danger I didn't want to drive the car again. Eventually they agreed to bring a different car out to me but NEVER mentioned a Fee. It wasn't until I returned home that I found 124 euros had been taken from my credit card without my permission. The company can only say I should have read the small print. I WILL NEVER USE THEM AGAIN and warn others to be careful.,0
Hi there,0
Thank you first of all for reminders for the new policy. That helps.,0
what I don't understand is why wasn't possible to be contacted by any of customer service to help me to updated my details and instead of this I am requested to contact myself. I think a little service to someone who didn't stopped you to renew a contract without any problem can be done.,0
Best regards,0
Items never arrived and I asked for a refund they responded to offering me one because my orders got lost in the mail they said I said yes and they haven't responded back and I have no refund .,0
